[
  {
    "schema_version": 1,
    "request_id": "extract_t1",
    "operation": "extract_object",
    "capability_id": "fixture.extract_rgba_v1",
    "input_artifacts": ["sha256:5050505050505050505050505050505050505050505050505050505050505050"],
    "logical_key": "tail_transition",
    "component_key": "T1",
    "prompt": "Isolate only T1 in the reserved empty arena; remove the background and preserve transparent RGBA without edge contact.",
    "output_kind": "transparent_rgba_object",
    "journal": {"retain_inputs": true, "retain_provider_output": true, "retain_output": true, "retain_reports": true},
    "extraction": {"source_arena": "reserved_empty", "visible_object_count": 1, "alpha_contract": "transparent_rgba", "background_removal": "required", "matte_policy": "fail_closed", "crop_after_verification": true, "fail_on_edge_contact": true},
    "video": null,
    "reuse": null
  },
  {
    "schema_version": 1,
    "request_id": "generate_b1_video",
    "operation": "generate_video",
    "capability_id": "fal-ai/pixverse/v6/transition",
    "input_artifacts": [
      "sha256:3333333333333333333333333333333333333333333333333333333333333333",
      "sha256:3434343434343434343434343434343434343434343434343434343434343434"
    ],
    "logical_key": "body_transition",
    "component_key": "B1",
    "prompt": "[Cinematography]\nStatic orthographic camera; flat 2D framing; no zoom, pan, tilt, parallax, or perspective.\n[Subject]\nPreserve the exact supplied B1 component shapes, proportions, edges, and palette.\n[Action / Transition]\nOnly the B1 component animates from the exact start state to the exact end state; motion remains compatible with a true cyclic final-to-zero closure.\n[Context]\nKeep the reserved matte arena and its background completely static; add no objects, shadows, text, scenery, or camera motion.\n[Style & Ambiance]\nFlat 2D production artwork; preserve exact colors and alpha/matte boundaries without restyling, lighting drift, or texture invention.",
    "output_kind": "video",
    "journal": {"retain_inputs": true, "retain_provider_output": true, "retain_output": true, "retain_reports": true},
    "extraction": null,
    "video": {
      "start_frame_sha256": "sha256:3333333333333333333333333333333333333333333333333333333333333333",
      "end_frame_sha256": "sha256:3434343434343434343434343434343434343434343434343434343434343434",
      "source_video_sha256": null,
      "common_period_ms": 2400,
      "desired_fps": 20,
      "derived_frame_rows": 48,
      "body_columns": 40,
      "texels_per_cell": 16,
      "raster_overhang_px": 4,
      "row_texels": 24,
      "effective_frame_row_cap": 85,
      "frame_extraction": "deterministic_uniform_full_period",
      "row_zero": "resting_and_reduced_motion",
      "alpha_matte_verification": "fail_closed",
      "loop_closure": "true_final_to_zero",
      "max_frame_rows": 120
    },
    "reuse": null
  },
  {
    "schema_version": 1,
    "request_id": "extract_b1_frames",
    "operation": "extract_video_frames",
    "capability_id": "fixture.frame_extraction_v1",
    "input_artifacts": ["sha256:3535353535353535353535353535353535353535353535353535353535353535"],
    "logical_key": "body_transition",
    "component_key": "B1",
    "prompt": "Extract deterministic full-period timestamps, verify the matte per frame, and retain the exact 48-row sheet.",
    "output_kind": "frame_sheet",
    "journal": {"retain_inputs": true, "retain_provider_output": true, "retain_output": true, "retain_reports": true},
    "extraction": {"source_arena": "reserved_empty", "visible_object_count": 1, "alpha_contract": "exact_mask_matte", "background_removal": "required", "matte_policy": "fail_closed", "crop_after_verification": true, "fail_on_edge_contact": true},
    "video": {
      "start_frame_sha256": "sha256:3333333333333333333333333333333333333333333333333333333333333333",
      "end_frame_sha256": "sha256:3434343434343434343434343434343434343434343434343434343434343434",
      "source_video_sha256": "sha256:3535353535353535353535353535353535353535353535353535353535353535",
      "common_period_ms": 2400,
      "desired_fps": 20,
      "derived_frame_rows": 48,
      "body_columns": 40,
      "texels_per_cell": 16,
      "raster_overhang_px": 4,
      "row_texels": 24,
      "effective_frame_row_cap": 85,
      "frame_extraction": "deterministic_uniform_full_period",
      "row_zero": "resting_and_reduced_motion",
      "alpha_matte_verification": "fail_closed",
      "loop_closure": "true_final_to_zero",
      "max_frame_rows": 120
    },
    "reuse": null
  },
  {
    "schema_version": 1,
    "request_id": "extract_h",
    "operation": "extract_object",
    "capability_id": "fixture.extract_rgba_v1",
    "input_artifacts": ["sha256:6060606060606060606060606060606060606060606060606060606060606060"],
    "logical_key": "head_detail",
    "component_key": "H",
    "prompt": "Isolate only H in the reserved empty arena; remove the background and preserve transparent RGBA without edge contact.",
    "output_kind": "transparent_rgba_object",
    "journal": {"retain_inputs": true, "retain_provider_output": true, "retain_output": true, "retain_reports": true},
    "extraction": {"source_arena": "reserved_empty", "visible_object_count": 1, "alpha_contract": "transparent_rgba", "background_removal": "required", "matte_policy": "fail_closed", "crop_after_verification": true, "fail_on_edge_contact": true},
    "video": null,
    "reuse": null
  },
  {
    "schema_version": 1,
    "request_id": "reuse_t2",
    "operation": "reuse_modifier",
    "capability_id": "fixture.reuse_modifier_v1",
    "input_artifacts": ["sha256:3cd92f814c2b560f62cbe65677e5165b7112d59edbc375e0069022a58b016526"],
    "logical_key": "tail_detail",
    "component_key": "T2",
    "prompt": "Bind the exact retained T2 modifier only after validating its target lineage authorization and forge lineage.",
    "output_kind": "modifier_binding",
    "journal": {"retain_inputs": true, "retain_provider_output": true, "retain_output": true, "retain_reports": true},
    "extraction": null,
    "video": null,
    "reuse": {
      "modifier_manifest_sha256": "sha256:3cd92f814c2b560f62cbe65677e5165b7112d59edbc375e0069022a58b016526",
      "target_lineage_id": "concept-modifier-workflow",
      "require_authorized_lineage": true,
      "cross_lineage_authority_sha256": null
    }
  }
]
